Timestamp,ID,Printify_Product_ID,eBay_Item_ID,Old_Title,Old_Description,Old_Price,New_Title,New_Description,New_Price
2026-05-07 00:46:18 -0400,Poster-Zen-0004,69f2dddb9577aaffd506bc32,406903026999,Zen Celestial Compass Poster 12x18 Wall Art Calm Study Decor Library Gift Room,"<p>This <strong>Celestial Compass Relic</strong> poster transforms a meditative symbol into a museum-grade wall statement. The design centers on an Imperial Green Jade compass with obsidian directional markers and amethyst constellation inlays, suspended in floating crystalline rings under twilight purple-gold lighting. The result is a balanced, minimalist composition that evokes mindfulness and cosmic order—ideal for a study desk, reading nook, or serene living space.</p><p>Printed on premium matte paper, this 12x18 poster delivers crisp detail and rich color depth. The subtle bioluminescent jade glow and handcrafted edge bevels are faithfully reproduced, making it a striking focal point for any room where you seek focus and calm. Whether used as a laptop background reference or a journaling companion, its quiet presence supports daily meditation and intellectual reflection.</p><ul><li><strong>Includes:</strong> One 12x18 poster (unframed)</li><li><strong>Material:</strong> Premium matte paper, museum-grade archival quality</li><li><strong>Size:</strong> 12x18 inches (30.5 x 45.7 cm)</li><li><strong>Style:</strong> Zen Mentor-Grade, celestial compass with jade, obsidian, and amethyst elements</li><li><strong>DNA Profile:</strong> Imperial Green Jade, Floating Obsidian, Amethyst, Crystalline Water, micro-engraved surface relief, handcrafted edge bevels, layered translucent depth, subtle internal bioluminescent glow, refined kintsugi-like vein logic, floating accent fragments with intentional negative space, cinematic rim lighting plus soft museum-grade overhead fill, crisp silhouette readability, centered premium product composition, clean contour separation, high-end collectible artifact aesthetic</li><li><strong>Use Cases:</strong> Wall art for zen study, meditation room, minimalist office, or as a mindful gift for journaling and water bottle enthusiasts</li></ul><p><strong>Image Note:</strong> The main image shows the actual product customers receive. Additional images are bonus concept/detail reference images and do not represent extra products or selectable variations.</p><p><em>Image Note: </em></p>",$34.99,Smoky Jade Wall Art Celestial Compass Calm Library 12x18 Matte Poster Library,"<h2>Smoky Jade Wall Art Celestial Compass Calm Library 12x18 Matte Poster Library</h2><p>A Quiet Jade collection piece built for quiet apartments, reading nooks, deep-work offices, study rooms, and gallery walls. The visual direction leans into smoky jade tones, quiet luxury decor language, kintsugi detail, and deep-work atmosphere instead of generic mass-market wall art.</p><ul><li><strong>Includes:</strong> One 12x18 premium matte vertical poster.</li><li><strong>Material:</strong> Premium matte paper wall art produced on demand through Printify.</li><li><strong>Style:</strong> Zen collector aesthetic; smoky jade, wabi-sabi, scholar-room mood.</li><li><strong>Best For:</strong> apartment decor, reading nook styling, focused workspaces, collectors, and giftable room accents.</li></ul><p><strong>Image Note:</strong> The main image shows the physical product customers receive. Additional gallery images are concept, detail, or collection-reference views and are not extra products or selectable variations.</p><p><strong>Search Themes:</strong> Celestial Compass Calm Library, Smoky Jade, Quiet Luxury Decor, Deep Work Visuals, Reading Nook Decor, Wabi Sabi Decor, Scholar Room, Apartment Decor, Jade Art, Kintsugi Aesthetic, Collector Gift, Meditation Decor, Calm Desk Art</p><p><small>Reference SKU: Poster-Zen-0004; Subject: Celestial Compass Calm Library</small></p>",$34.99
2026-05-07 00:46:18 -0400,Poster-Zen-0005,69f2db1a3c6616b960034a37,406903033377,Zen Phoenix Rebirth Vessel 12x18 Poster for Meditation Room Decor Wall Study,"<p>Bring the serene energy of an ancient ceremonial artifact into your space with this Zen Mentor-Grade poster. The Phoenix Rebirth Vessel rises in a graceful spiral, its Imperial Green Jade wings unfurling above obsidian talons that grip an amethyst flame base. Crystalline water flows upward in a luminous dance, while twilight purple-gold light and subtle bioluminescent glow create a museum-quality focal point for mindfulness and balance.</p><p>Printed on premium matte paper, this 12x18 vertical poster fits perfectly in a meditation corner, study desk area, or minimalist living room. The hyper-detailed design with micro-engraved relief and floating accent fragments invites quiet contemplation, making it an ideal companion for journaling, reading, or simply unwinding after a long day. Its clean silhouette and intentional negative space complement both modern and traditional decor.</p><ul><li><b>Includes:</b> One 12x18 poster (unframed)</li><li><b>Material:</b> Premium matte paper, 200 gsm</li><li><b>Size:</b> 12 x 18 inches (30.5 x 45.7 cm)</li><li><b>Style:</b> Zen Mentor-Grade, dark academia compatible</li><li><b>DNA Profile:</b> Imperial Green Jade, Floating Obsidian, Amethyst, Crystalline Water, twilight purple-gold lighting, bioluminescent glow, kintsugi vein logic, floating accent fragments, micro-engraved surface relief</li><li><b>Use Cases:</b> Meditation room decor, study desk accent, yoga studio wall art, bedroom calm corner, office mindfulness space, gift for journal lovers and water bottle collectors</li></ul><p><strong>Image Note:</strong> The main image shows the actual product customers receive. Additional images are bonus concept/detail reference images and do not represent extra products or selectable variations.</p><p><b>Image Note:</b>",$34.99,Quiet Luxury Apartment Art Phoenix Rebirth Vessel for Meditation 12x18 Matte,"<h2>Quiet Luxury Apartment Art Phoenix Rebirth Vessel for Meditation 12x18 Matte</h2><p>A Quiet Jade collection piece built for quiet apartments, reading nooks, deep-work offices, study rooms, and gallery walls. The visual direction leans into smoky jade tones, quiet luxury decor language, kintsugi detail, and deep-work atmosphere instead of generic mass-market wall art.</p><ul><li><strong>Includes:</strong> One 12x18 premium matte vertical poster.</li><li><strong>Material:</strong> Premium matte paper wall art produced on demand through Printify.</li><li><strong>Style:</strong> Zen collector aesthetic; smoky jade, wabi-sabi, scholar-room mood.</li><li><strong>Best For:</strong> apartment decor, reading nook styling, focused workspaces, collectors, and giftable room accents.</li></ul><p><strong>Image Note:</strong> The main image shows the physical product customers receive. Additional gallery images are concept, detail, or collection-reference views and are not extra products or selectable variations.</p><p><strong>Search Themes:</strong> Phoenix Rebirth Vessel for Meditation, Smoky Jade, Quiet Luxury Decor, Deep Work Visuals, Reading Nook Decor, Wabi Sabi Decor, Scholar Room, Apartment Decor, Jade Art, Kintsugi Aesthetic, Collector Gift, Meditation Decor, Calm Desk Art</p><p><small>Reference SKU: Poster-Zen-0005; Subject: Phoenix Rebirth Vessel for Meditation</small></p>",$34.99
2026-05-07 00:46:18 -0400,Acrylic-Academia-0003,69f2b9c3caeb1241880bae85,406902703464,Celestial Orrery Tree Bonsai Dark Academia 5x7 Acrylic Block Mentor-Grade Study,"<p>This Celestial Orrery Tree Bonsai acrylic block merges botanical astronomy with mentor-grade dark academia aesthetics. A Moonstone trunk and Imperial Jade planets form a miniature cosmos, suspended in crystalline soil with floating talisman fragments. The 5x7 vertical format fits perfectly on a study desk, bookshelf, or gallery wall, offering a luminous focal point for intellectual spaces.</p><p>Designed for collectors and scholars, this piece channels vintage observatory charts and ink-wash nebula atmosphere. The translucent foliage glows with subtle bioluminescence, while micro-engraved surface relief adds tactile depth. Use it as a meditation aid, a gift for a book lover, or a centerpiece in a home library.</p><ul><li><strong>Includes:</strong> One 5x7 acrylic block with built-in stand</li><li><strong>Material:</strong> Premium clear acrylic with internal print</li><li><strong>Size:</strong> 5x7 inches (vertical)</li><li><strong>Style:</strong> Academia Mentor-Grade</li><li><strong>DNA Profile:</strong> Moonstone trunk, Imperial Jade planets, ink-wash nebula, crystalline soil, floating talisman fragments, bioluminescent leaves, micro-engraved surface relief</li><li><strong>Use Cases:</strong> Study desk decor, home library accent, mentor gift, vintage intellectual display, botanical art collection</li></ul><p><strong>Image Note:</strong> The main image shows the actual product customers receive. Additional images are bonus concept/detail reference images and do not represent extra products or selectable variations.</p><p><em>Image Note: </em></p>",$89.99,Quiet Luxury Shelf Decor Celestial Orrery Tree Bonsai 5x7 Acrylic Photo Block,"<h2>Quiet Luxury Shelf Decor Celestial Orrery Tree Bonsai 5x7 Acrylic Photo Block</h2><p>A Quiet Jade collection piece built for desks, bookshelves, altar corners, office focus spaces, and collector displays. The visual direction leans into smoky jade tones, quiet luxury decor language, kintsugi detail, and deep-work atmosphere instead of generic mass-market wall art.</p><ul><li><strong>Includes:</strong> One 5x7 vertical acrylic photo block.</li><li><strong>Material:</strong> Acrylic block display with depth, gloss, and light-reflective finish.</li><li><strong>Style:</strong> Academia collector aesthetic; smoky jade, wabi-sabi, scholar-room mood.</li><li><strong>Best For:</strong> apartment decor, reading nook styling, focused workspaces, collectors, and giftable room accents.</li></ul><p><strong>Image Note:</strong> The main image shows the physical product customers receive. Additional gallery images are concept, detail, or collection-reference views and are not extra products or selectable variations.</p><p><strong>Search Themes:</strong> Celestial Orrery Tree Bonsai, Smoky Jade, Quiet Luxury Decor, Deep Work Visuals, Reading Nook Decor, Wabi Sabi Decor, Scholar Room, Apartment Decor, Jade Art, Kintsugi Aesthetic, Collector Gift, Dark Study Decor, Library Wall Art</p><p><small>Reference SKU: Acrylic-Academia-0003; Subject: Celestial Orrery Tree Bonsai</small></p>",$89.99
2026-05-07 00:46:18 -0400,Acrylic-Academia-0005,69f80ad2d3b9dc73b1051dbd,406903039716,Alchemical Star Flask Vessel 5x7 Acrylic Block Dark Academia Desk Decor Shelf,"<p>Elevate your study sanctuary with the Alchemical Star Flask Vessel, a premium 5x7 acrylic block that transforms an alchemical flask into a contained universe of celestial wonder. This mentor-grade collectible captures a Moonstone body with Imperial Jade stopper, swirling liquid cosmos, and bioluminescent nebula essence, perfect for dark academia enthusiasts and intellectual decor lovers.</p><p>Display this luminous piece on your desk, bookshelf, or gallery wall to inspire deep thought and vintage study vibes. The translucent depth and micro-engraved sacred geometry create a mesmerizing focal point that pairs beautifully with journals, potion bottles, and antique books.</p><ul><li><strong>Includes:</strong> One 5x7 acrylic block with printed design</li><li><strong>Material:</strong> Premium clear acrylic with UV-resistant print</li><li><strong>Size:</strong> 5x7 inches (12.7 x 17.8 cm)</li><li><strong>Style:</strong> Academia Mentor-Grade, dark academia aesthetic</li><li><strong>DNA Profile:</strong> Alchemical flask, star vessel, Moonstone container, Imperial Jade stopper, liquid cosmos, celestial potion, academia alchemy, contained universe, sacred geometry, premium acrylic bottle, mentor-grade glasswork, translucent elixir, bioluminescent fluid, gallery apothecary art</li><li><strong>Use Cases:</strong> Desk decor, bookshelf accent, study room art, gift for book lovers, student inspiration, vintage intellectual collection</li></ul><p><strong>Image Note:</strong> The main image shows the actual product customers receive. Additional images are bonus concept/detail reference images and do not represent extra products or selectable variations.</p><p><em>Image Note:</em>",$89.99,Collector Acrylic Relic Alchemical Star Flask Vessel 5x7 Acrylic Photo Block,"<h2>Collector Acrylic Relic Alchemical Star Flask Vessel 5x7 Acrylic Photo Block</h2><p>A Quiet Jade collection piece built for desks, bookshelves, altar corners, office focus spaces, and collector displays. The visual direction leans into smoky jade tones, quiet luxury decor language, kintsugi detail, and deep-work atmosphere instead of generic mass-market wall art.</p><ul><li><strong>Includes:</strong> One 5x7 vertical acrylic photo block.</li><li><strong>Material:</strong> Acrylic block display with depth, gloss, and light-reflective finish.</li><li><strong>Style:</strong> Academia collector aesthetic; smoky jade, wabi-sabi, scholar-room mood.</li><li><strong>Best For:</strong> apartment decor, reading nook styling, focused workspaces, collectors, and giftable room accents.</li></ul><p><strong>Image Note:</strong> The main image shows the physical product customers receive. Additional gallery images are concept, detail, or collection-reference views and are not extra products or selectable variations.</p><p><strong>Search Themes:</strong> Alchemical Star Flask Vessel, Smoky Jade, Quiet Luxury Decor, Deep Work Visuals, Reading Nook Decor, Wabi Sabi Decor, Scholar Room, Apartment Decor, Jade Art, Kintsugi Aesthetic, Collector Gift, Dark Study Decor, Library Wall Art</p><p><small>Reference SKU: Acrylic-Academia-0005; Subject: Alchemical Star Flask Vessel</small></p>",$89.99
2026-05-07 00:46:18 -0400,Acrylic-Grimdark-0001,69f82b8aa1a4c45aad055063,406903249745,Gothic Lantern Soul Cage 5x7 Acrylic Block Grimdark Study Decor Crimson Flame,"<p>This 5x7 acrylic block captures the <strong>Crimson Warden's Soul Cage</strong>, a grimdark artifact where a trapped crimson spirit flame glows within an ornate wrought-iron lantern. Cracked ghostly ruby glass refracts light, creating a haunting, museum-quality display for collectors of dark fantasy.</p><p>Place this premium block on your study desk, bookshelf, or altar to evoke a mood of ancient power and introspection. The internal bioluminescent effect and micro-engraved filigree reward close inspection, making it a conversation piece for gothic or fantasy-themed spaces.</p><ul><li><strong>Includes:</strong> One 5x7 acrylic block with stand</li><li><strong>Material:</strong> High-clarity acrylic with UV-printed interior design</li><li><strong>Size:</strong> 5x7 inches (portrait orientation)</li><li><strong>Style:</strong> Grimdark Mentor-Grade — wrought iron, ghostly ruby glass, crimson spirit flame, gothic filigree</li><li><strong>DNA Profile:</strong> Ornate wrought-iron lantern, trapped swirling crimson flame, cracked ruby glass, refractive light, internal glow, micro-engraved surface relief, handcrafted edge bevels, layered translucent depth, kintsugi-like vein logic, floating accent fragments, cinematic rim lighting, soft museum fill, crisp silhouette, centered composition, isolated on white</li><li><strong>Use Cases:</strong> Study desk decor, bookshelf accent, gothic altar piece, dark fantasy collector display, Halloween ambiance, gift for grimdark enthusiasts</li></ul><p><strong>Image Note:</strong> The main image shows the actual product customers receive. Additional images are bonus concept/detail reference images and do not represent extra products or selectable variations.</p><p><em>Image Note: </em></p>",$89.99,Deep Work Desk Visual Lantern Soul Cage Crimson Flame 5x7 Acrylic Photo Block,"<h2>Deep Work Desk Visual Lantern Soul Cage Crimson Flame 5x7 Acrylic Photo Block</h2><p>A Quiet Jade collection piece built for desks, bookshelves, altar corners, office focus spaces, and collector displays. The visual direction leans into smoky jade tones, quiet luxury decor language, kintsugi detail, and deep-work atmosphere instead of generic mass-market wall art.</p><ul><li><strong>Includes:</strong> One 5x7 vertical acrylic photo block.</li><li><strong>Material:</strong> Acrylic block display with depth, gloss, and light-reflective finish.</li><li><strong>Style:</strong> Grimdark collector aesthetic; smoky jade, wabi-sabi, scholar-room mood.</li><li><strong>Best For:</strong> apartment decor, reading nook styling, focused workspaces, collectors, and giftable room accents.</li></ul><p><strong>Image Note:</strong> The main image shows the physical product customers receive. Additional gallery images are concept, detail, or collection-reference views and are not extra products or selectable variations.</p><p><strong>Search Themes:</strong> Lantern Soul Cage Crimson Flame, Smoky Jade, Quiet Luxury Decor, Deep Work Visuals, Reading Nook Decor, Wabi Sabi Decor, Scholar Room, Apartment Decor, Jade Art, Kintsugi Aesthetic, Collector Gift, Gothic Study Decor, Alchemy Decor</p><p><small>Reference SKU: Acrylic-Grimdark-0001; Subject: Lantern Soul Cage Crimson Flame</small></p>",$89.99
2026-05-07 00:46:18 -0400,Acrylic-Grimdark-0004,69f82c8609f3b7302401cacf,406903250705,Grimdark Gothic Lantern 5x7 Acrylic Block Shadowbound Sentinel Beacon Dark Gift,"<p>This 5x7 acrylic block captures the grimdark essence of the Shadowbound Sentinel's Beacon, a gothic lantern forged from heavy wrought iron with a skeletal framework. Inside, a trapped ice-blue spirit flame flickers through cracked ghostly frost glass, creating an eerie internal glow that defines this mentor-grade collectible.</p><p>Perfect for dark fantasy enthusiasts and gothic decor lovers, this premium print brings a shadowbound artifact to life on a sleek acrylic surface. Place it on a study desk, shelf, or altar to evoke the balance of light and shadow, or gift it to a collector of macabre art who appreciates refined, minimalist display pieces.</p><ul><li><strong>Includes:</strong> One 5x7 acrylic block with stand</li><li><strong>Material:</strong> High-quality clear acrylic with vibrant UV-cured print</li><li><strong>Size:</strong> 5x7 inches (portrait orientation)</li><li><strong>Style:</strong> Grimdark Mentor-Grade, featuring wrought iron, ghostly frost glass, ice-blue spirit flame, gothic filigree, micro-engraved surface relief, handcrafted edge bevels, layered translucent depth, subtle internal bioluminescent glow, refined kintsugi-like vein logic, floating accent fragments, cinematic rim lighting, museum-grade overhead fill</li><li><strong>DNA Profile:</strong> Sentinel beacon, ice-blue flame, frost glass, skeletal lantern, grimdark design, spirit light, gothic collectible, shadowbound artifact, refractive glass, internal glow, premium fantasy</li><li><strong>Use Cases:</strong> Dark fantasy decor, gothic study accent, collector's shelf display, Halloween ambiance, gift for grimdark art lovers, meditation on light and shadow</li></ul><p><strong>Image Note:</strong> The main image shows the actual product customers receive. Additional images are bonus concept/detail reference images and do not represent extra products or selectable variations.</p><p><em>Image Note: </em></p>",$89.99,Smoky Jade Desk Object Lantern Shadowbound Sentinel Beacon 5x7 Acrylic Photo,"<h2>Smoky Jade Desk Object Lantern Shadowbound Sentinel Beacon 5x7 Acrylic Photo</h2><p>A Quiet Jade collection piece built for desks, bookshelves, altar corners, office focus spaces, and collector displays. The visual direction leans into smoky jade tones, quiet luxury decor language, kintsugi detail, and deep-work atmosphere instead of generic mass-market wall art.</p><ul><li><strong>Includes:</strong> One 5x7 vertical acrylic photo block.</li><li><strong>Material:</strong> Acrylic block display with depth, gloss, and light-reflective finish.</li><li><strong>Style:</strong> Grimdark collector aesthetic; smoky jade, wabi-sabi, scholar-room mood.</li><li><strong>Best For:</strong> apartment decor, reading nook styling, focused workspaces, collectors, and giftable room accents.</li></ul><p><strong>Image Note:</strong> The main image shows the physical product customers receive. Additional gallery images are concept, detail, or collection-reference views and are not extra products or selectable variations.</p><p><strong>Search Themes:</strong> Lantern Shadowbound Sentinel Beacon, Smoky Jade, Quiet Luxury Decor, Deep Work Visuals, Reading Nook Decor, Wabi Sabi Decor, Scholar Room, Apartment Decor, Jade Art, Kintsugi Aesthetic, Collector Gift, Gothic Study Decor, Alchemy Decor</p><p><small>Reference SKU: Acrylic-Grimdark-0004; Subject: Lantern Shadowbound Sentinel Beacon</small></p>",$89.99
2026-05-07 00:46:18 -0400,Acrylic-Grimdark-0005,69f8388b25819cdf3d0538bc,406903251829,Gothic Necromancer Soul Reliquary 5x7 Acrylic Grimdark Artifact Decor Shelf,"<p>This 5x7 acrylic print transforms the Necromancer's Soul Reliquary into a luminous grimdark artifact for your wall. The design captures a wrought-iron lantern with skull motifs, encasing a swirling green spirit flame that refracts through ghostly emerald glass. High-contrast shadows and a bioluminescent core create a premium dark fantasy presence, ideal for collectors of gothic and occult aesthetics.</p><p>Display this piece on a study desk, altar shelf, or reading nook to evoke an atmosphere of ancient power and mystery. The acrylic material enhances the refractive light and internal glow, making the green flame appear to pulse with life. It serves as a striking conversation starter for fans of necromancer lore, soul reliquaries, and grimdark worldbuilding.</p><ul><li><strong>Includes:</strong> One 5x7 acrylic print, ready to hang or stand with included easel back</li><li><strong>Material:</strong> High-gloss acrylic, 1/4 inch thick, with UV-resistant inks</li><li><strong>Size:</strong> 5x7 inches (12.7 x 17.8 cm)</li><li><strong>Style:</strong> Grimdark Mentor-Grade, featuring wrought iron, ghostly emerald glass, green spirit flame, gothic filigree, and micro-engraved surface relief</li><li><strong>DNA Profile:</strong> Gothic lantern, soul reliquary, green flame, emerald glass, skull motif, grimdark collectible, spirit vessel, gothic artifact, refractive light, bioluminescent core, premium dark fantasy</li><li><strong>Use Cases:</strong> Wall decor for gothic rooms, occult study spaces, dark fantasy collections, Halloween year-round displays, or as a unique gift for necromancer enthusiasts</li></ul><p><strong>Image Note:</strong> The main image shows the actual product customers receive. Additional images are bonus concept/detail reference images and do not represent extra products or selectable variations.</p><p><em>Image Note: </em></p>",$89.99,Quiet Luxury Shelf Decor Necromancer Soul Reliquary Artifact 5x7 Acrylic Photo,"<h2>Quiet Luxury Shelf Decor Necromancer Soul Reliquary Artifact 5x7 Acrylic Photo</h2><p>A Quiet Jade collection piece built for desks, bookshelves, altar corners, office focus spaces, and collector displays. The visual direction leans into smoky jade tones, quiet luxury decor language, kintsugi detail, and deep-work atmosphere instead of generic mass-market wall art.</p><ul><li><strong>Includes:</strong> One 5x7 vertical acrylic photo block.</li><li><strong>Material:</strong> Acrylic block display with depth, gloss, and light-reflective finish.</li><li><strong>Style:</strong> Grimdark collector aesthetic; smoky jade, wabi-sabi, scholar-room mood.</li><li><strong>Best For:</strong> apartment decor, reading nook styling, focused workspaces, collectors, and giftable room accents.</li></ul><p><strong>Image Note:</strong> The main image shows the physical product customers receive. Additional gallery images are concept, detail, or collection-reference views and are not extra products or selectable variations.</p><p><strong>Search Themes:</strong> Necromancer Soul Reliquary Artifact, Smoky Jade, Quiet Luxury Decor, Deep Work Visuals, Reading Nook Decor, Wabi Sabi Decor, Scholar Room, Apartment Decor, Jade Art, Kintsugi Aesthetic, Collector Gift, Gothic Study Decor, Alchemy Decor</p><p><small>Reference SKU: Acrylic-Grimdark-0005; Subject: Necromancer Soul Reliquary Artifact</small></p>",$89.99
