Timestamp,ID,Printify_Product_ID,eBay_Item_ID,Old_Title,Old_Description,Old_Price,New_Title,New_Description,New_Price
2026-05-07 00:46:18 -0400,Poster-Academia-0002,69f2906f7f1017d51b0d5f76,406902600741,Dark Academia Obsidian Threshold Poster 12x18 Vintage Study Decor Mentor Wisdom,"<p>Step into a realm of eternal scholarship with this dark academia poster, where a monumental threshold of polished moonstone and imperial jade frames a mystical passage of floating tomes and brass-inscribed charms. The cinematic chiaroscuro lighting and cosmic ink-wash mists evoke a mentor-grade artifact, perfect for inspiring deep focus and intellectual wonder.</p><p>Ideal for adorning a study desk, library wall, or reading nook, this 12x18 poster transforms any space into a vintage sanctuary of wisdom. The ultra-detailed moonstone surface patterns and kintsugi-like vein logic reward close inspection, while the floating accent fragments create a sense of layered depth and narrative intrigue.</p><ul><li><strong>Includes:</strong> One 12x18 poster (unframed)</li><li><strong>Material:</strong> Premium matte paper, archival quality</li><li><strong>Size:</strong> 12 x 18 inches</li><li><strong>Style:</strong> Academia Mentor-Grade, dark academia aesthetic</li><li><strong>DNA Profile:</strong> Moonstone, Imperial Jade, Ancient Calfskin, Burnished Brass, Ink-wash Nebula; micro-engraved surface relief, handcrafted edge bevels, layered translucent depth, subtle bioluminescent glow, floating accent fragments with intentional negative space</li><li><strong>Use Cases:</strong> Study desk decor, library wall art, book lover gift, vintage intellectual room accent, student dorm inspiration</li></ul><p><strong>Image Note:</strong> The main image shows the actual product customers receive. Additional images are bonus concept/detail reference images and do not represent extra products or selectable variations.</p>",$34.99,Deep Work Visual Poster Obsidian Threshold Vintage Mentor Wisdom 12x18 Matte,"<h2>Deep Work Visual Poster Obsidian Threshold Vintage Mentor Wisdom 12x18 Matte</h2><p>A Quiet Jade collection piece built for quiet apartments, reading nooks, deep-work offices, study rooms, and gallery walls. The visual direction leans into smoky jade tones, quiet luxury decor language, kintsugi detail, and deep-work atmosphere instead of generic mass-market wall art.</p><ul><li><strong>Includes:</strong> One 12x18 premium matte vertical poster.</li><li><strong>Material:</strong> Premium matte paper wall art produced on demand through Printify.</li><li><strong>Style:</strong> Academia collector aesthetic; smoky jade, wabi-sabi, scholar-room mood.</li><li><strong>Best For:</strong> apartment decor, reading nook styling, focused workspaces, collectors, and giftable room accents.</li></ul><p><strong>Image Note:</strong> The main image shows the physical product customers receive. Additional gallery images are concept, detail, or collection-reference views and are not extra products or selectable variations.</p><p><strong>Search Themes:</strong> Obsidian Threshold Vintage Mentor Wisdom, Smoky Jade, Quiet Luxury Decor, Deep Work Visuals, Reading Nook Decor, Wabi Sabi Decor, Scholar Room, Apartment Decor, Jade Art, Kintsugi Aesthetic, Collector Gift, Dark Study Decor, Library Wall Art</p><p><small>Reference SKU: Poster-Academia-0002; Subject: Obsidian Threshold Vintage Mentor Wisdom</small></p>",$34.99
2026-05-07 00:46:18 -0400,Poster-Academia-0003,69f29152357398ded80f8178,406902616799,Dark Academia Serpentine Portal of Alchemical Texts 12x18 Poster Study Decor,"<p>Step into a world of arcane knowledge with this <b>Serpentine Portal of Alchemical Texts</b> poster, a masterpiece of dark academia artistry. The design features an iridescent moonstone and imperial jade gateway, surrounded by floating leather volumes and brass talismans with hermetic symbols, all set against a nebulous ink-wash sky. This piece captures the intellectual mystery of a levitating archive, perfect for those who cherish vintage study aesthetics and alchemical lore.</p><p>Printed on premium semi-gloss paper, this 12x18 poster delivers rich, cinematic chiaroscuro lighting and jade phosphorescence, making it an ideal focal point for a study desk, library wall, or book lover's sanctuary. The ultra-detailed moonstone iridescence and brass gear mechanisms invite close inspection, while the clean contour separation ensures it stands out in any frame. Whether you're a student, collector, or mentor-grade enthusiast, this poster transforms your space into a portal of esoteric discovery.</p><ul><li><b>Includes:</b> One 12x18 poster (unframed)</li><li><b>Material:</b> Premium semi-gloss paper, 200 gsm, archival quality</li><li><b>Size:</b> 12 x 18 inches (30.48 x 45.72 cm)</li><li><b>Style:</b> Dark Academia, Mentor-Grade, Alchemical Art</li><li><b>DNA Profile:</b> Serpentine portal, iridescent moonstone, imperial jade, ancient calfskin, burnished brass, ink-wash nebula, micro-engraved surface relief, handcrafted edge bevels, layered translucent depth, bioluminescent glow, kintsugi vein logic, floating accent fragments, cinematic rim lighting, museum-grade overhead fill, crisp silhouette, centered composition, high-end collectible artifact aesthetic, isolated on white background</li><li><b>Use Cases:</b> Study desk decor, library wall art, book lover gift, vintage intellectual room accent, dark academia dorm or office, alchemy collector display</li></ul><p><strong>Image Note:</strong> The main image shows the actual product customers receive. Additional images are bonus concept/detail reference images and do not represent extra products or selectable variations.</p><p><b>Image Note:</b>",$34.99,Reading Nook Wall Decor Serpentine Portal of Alchemical Texts 12x18 Matte Gift,"<h2>Reading Nook Wall Decor Serpentine Portal of Alchemical Texts 12x18 Matte Gift</h2><p>A Quiet Jade collection piece built for quiet apartments, reading nooks, deep-work offices, study rooms, and gallery walls. The visual direction leans into smoky jade tones, quiet luxury decor language, kintsugi detail, and deep-work atmosphere instead of generic mass-market wall art.</p><ul><li><strong>Includes:</strong> One 12x18 premium matte vertical poster.</li><li><strong>Material:</strong> Premium matte paper wall art produced on demand through Printify.</li><li><strong>Style:</strong> Academia collector aesthetic; smoky jade, wabi-sabi, scholar-room mood.</li><li><strong>Best For:</strong> apartment decor, reading nook styling, focused workspaces, collectors, and giftable room accents.</li></ul><p><strong>Image Note:</strong> The main image shows the physical product customers receive. Additional gallery images are concept, detail, or collection-reference views and are not extra products or selectable variations.</p><p><strong>Search Themes:</strong> Serpentine Portal of Alchemical Texts, Smoky Jade, Quiet Luxury Decor, Deep Work Visuals, Reading Nook Decor, Wabi Sabi Decor, Scholar Room, Apartment Decor, Jade Art, Kintsugi Aesthetic, Collector Gift, Dark Study Decor, Library Wall Art</p><p><small>Reference SKU: Poster-Academia-0003; Subject: Serpentine Portal of Alchemical Texts</small></p>",$34.99
2026-05-07 00:46:18 -0400,Poster-Academia-0005,69f847b45da263f75f04cdbd,406903038850,Arcane Archway of Forbidden Chronicles Dark Academia 12x18 Poster Study Room,"<p>Step into a world of esoteric knowledge with this mentor-grade poster, where an imposing archway of translucent moonstone and imperial jade frames a floating bibliotheca vault. Preserved calfskin codices spiral through the gateway, while ink-wash cosmic vapor mingles with ancient paper essence and levitating brass charm shards etched with occult markings. The cinematic chiaroscuro lighting and jade luminous aura evoke the depth of dark academia, making this piece a collector's treasure for intellectual spaces.</p><p>Printed on premium semi-gloss poster paper, this 12x18 artwork is ideal for adorning a study desk, library wall, or vintage-inspired reading nook. The ultra-detailed moonstone translucency and brass esoteric mechanisms ensure a visually arresting display that sparks conversation and contemplation. Whether you're a book lover, student, or curator of the arcane, this poster brings a touch of forbidden chronicles to your daily environment.</p><ul><li><strong>Includes:</strong> One 12x18 poster (unframed)</li><li><strong>Material:</strong> Semi-gloss poster paper (200 gsm)</li><li><strong>Size:</strong> 12 x 18 inches (30.48 x 45.72 cm)</li><li><strong>Style:</strong> Academia Mentor-Grade – dark academia, vintage, intellectual</li><li><strong>DNA Profile:</strong> Arcane archway, forbidden chronicles, translucent moonstone, jade aura, occult markings, floating vault, brass charms, cosmic vapor, preserved codices, esoteric design</li><li><strong>Use Cases:</strong> Study room decor, library wall art, student gift, intellectual collector piece, vintage-inspired home accent</li></ul><p><strong>Image Note:</strong> The main image shows the actual product customers receive. Additional images are bonus concept/detail reference images and do not represent extra products or selectable variations.</p><p><em>Image Note:</em>",$34.99,Smoky Jade Wall Art Arcane Archway of Forbidden Chronicles 12x18 Matte Poster,"<h2>Smoky Jade Wall Art Arcane Archway of Forbidden Chronicles 12x18 Matte Poster</h2><p>A Quiet Jade collection piece built for quiet apartments, reading nooks, deep-work offices, study rooms, and gallery walls. The visual direction leans into smoky jade tones, quiet luxury decor language, kintsugi detail, and deep-work atmosphere instead of generic mass-market wall art.</p><ul><li><strong>Includes:</strong> One 12x18 premium matte vertical poster.</li><li><strong>Material:</strong> Premium matte paper wall art produced on demand through Printify.</li><li><strong>Style:</strong> Academia collector aesthetic; smoky jade, wabi-sabi, scholar-room mood.</li><li><strong>Best For:</strong> apartment decor, reading nook styling, focused workspaces, collectors, and giftable room accents.</li></ul><p><strong>Image Note:</strong> The main image shows the physical product customers receive. Additional gallery images are concept, detail, or collection-reference views and are not extra products or selectable variations.</p><p><strong>Search Themes:</strong> Arcane Archway of Forbidden Chronicles, Smoky Jade, Quiet Luxury Decor, Deep Work Visuals, Reading Nook Decor, Wabi Sabi Decor, Scholar Room, Apartment Decor, Jade Art, Kintsugi Aesthetic, Collector Gift, Dark Study Decor, Library Wall Art</p><p><small>Reference SKU: Poster-Academia-0005; Subject: Arcane Archway of Forbidden Chronicles</small></p>",$34.99
2026-05-07 00:46:18 -0400,Poster-Academia-0006,69f84864feed9979d10cd5ba,406903042690,Dark Academia Ethereal Torii Poster 12x18 Study Room Decor Scholarly Ascension,"<p>Step into a realm where ancient wisdom meets celestial artistry. This <strong>Dark Academia Ethereal Torii Poster</strong> presents a majestic torii gate crafted from opalescent moonstone and imperial jade, standing before a luminous knowledge repository. Historical calfskin volumes drift through the ethereal passage, while ink-wash galaxy clouds fuse with manuscript vapor and floating brass amulet fragments inscribed with scholarly runes. The cinematic chiaroscuro lighting and jade ethereal glow evoke a mentor-grade aesthetic, perfect for intellectual sanctuaries.</p> <p>Printed on premium semi-gloss poster paper, this 12x18 inch piece delivers rich color depth and crisp detail, making it an ideal focal point for a study, library, or reading nook. The ultra-detailed moonstone opalescence and brass scholarly mechanisms are rendered with hyper-realistic precision, ensuring a captivating visual experience that inspires deep thought and creative exploration.</p> <ul> <li><strong>Includes:</strong> One 12x18 inch poster (unframed)</li> <li><strong>Material:</strong> Premium semi-gloss poster paper (200 gsm)</li> <li><strong>Size:</strong> 12 x 18 inches (30.5 x 45.7 cm)</li> <li><strong>Style:</strong> Dark Academia, Mentor-Grade, Ethereal Fantasy</li> <li><strong>DNA Profile:</strong> Opalescent moonstone, imperial jade, ancient calfskin, burnished brass, ink-wash nebula, micro-engraved surface relief, visible handcrafted edge bevels, layered translucent depth, subtle internal bioluminescent glow, refined kintsugi-like vein logic, floating accent fragments with intentional negative space, cinematic rim lighting plus soft museum-grade overhead fill</li> <li><strong>Use Cases:</strong> Study desk accent, library wall art, vintage book lover gift, student dorm decor, intellectual workspace inspiration, dark academia bedroom aesthetic</li> </ul><p><strong>Image Note:</strong> The main image shows the actual product customers receive. Additional images are bonus concept/detail reference images and do not represent extra products or selectable variations.</p> <p><em>Image Note: </em></p>",$34.99,Quiet Luxury Apartment Art Ethereal Torii Scholarly Ascension 12x18 Matte Decor,"<h2>Quiet Luxury Apartment Art Ethereal Torii Scholarly Ascension 12x18 Matte Decor</h2><p>A Quiet Jade collection piece built for quiet apartments, reading nooks, deep-work offices, study rooms, and gallery walls. The visual direction leans into smoky jade tones, quiet luxury decor language, kintsugi detail, and deep-work atmosphere instead of generic mass-market wall art.</p><ul><li><strong>Includes:</strong> One 12x18 premium matte vertical poster.</li><li><strong>Material:</strong> Premium matte paper wall art produced on demand through Printify.</li><li><strong>Style:</strong> Academia collector aesthetic; smoky jade, wabi-sabi, scholar-room mood.</li><li><strong>Best For:</strong> apartment decor, reading nook styling, focused workspaces, collectors, and giftable room accents.</li></ul><p><strong>Image Note:</strong> The main image shows the physical product customers receive. Additional gallery images are concept, detail, or collection-reference views and are not extra products or selectable variations.</p><p><strong>Search Themes:</strong> Ethereal Torii Scholarly Ascension, Smoky Jade, Quiet Luxury Decor, Deep Work Visuals, Reading Nook Decor, Wabi Sabi Decor, Scholar Room, Apartment Decor, Jade Art, Kintsugi Aesthetic, Collector Gift, Dark Study Decor, Library Wall Art</p><p><small>Reference SKU: Poster-Academia-0006; Subject: Ethereal Torii Scholarly Ascension</small></p>",$34.99
2026-05-07 00:46:18 -0400,Poster-Academia-0008,69f84b3d5da263f75f04d1f7,406903046097,Dark Academia Mystic Threshold Infinite Knowledge Poster 12x18 Study Decor Wall,"<p>Step into a realm where ancient wisdom meets celestial mystery. This 12x18 poster captures a luminescent moonstone and imperial jade threshold opening into an infinite library expanse, with orbiting calfskin manuscripts and floating brass rune fragments. A perfect artifact for the intellectual soul who finds beauty in the arcane.</p><p>Ideal for adorning a study desk, library wall, or meditation nook, this print brings a dark academia aesthetic to any space. The ink-wash infinity clouds and jade mystical luminescence create a cinematic atmosphere that inspires deep thought and quiet reflection. Whether as a gift for a book lover, student, or mentor, it serves as a daily reminder of boundless knowledge.</p><ul><li><strong>Includes:</strong> One 12x18 poster (unframed)</li><li><strong>Material:</strong> Premium matte paper, archival quality</li><li><strong>Size:</strong> 12 x 18 inches (30.48 x 45.72 cm)</li><li><strong>Style:</strong> Academia Mentor-Grade, dark academia, mystical</li><li><strong>DNA Profile:</strong> Mystic threshold, infinite knowledge, moonstone, jade, calfskin manuscripts, brass runes, ink-wash nebula, dark academia, library realm, cinematic chiaroscuro</li><li><strong>Use Cases:</strong> Study room decor, library wall art, vintage intellectual gift, student dorm, home office inspiration</li></ul><p><strong>Image Note:</strong> The main image shows the actual product customers receive. Additional images are bonus concept/detail reference images and do not represent extra products or selectable variations.</p><p><em>Image Note: </em></p>",$34.99,Reading Nook Wall Decor Mystic Threshold Infinite Knowledge 12x18 Matte Poster,"<h2>Reading Nook Wall Decor Mystic Threshold Infinite Knowledge 12x18 Matte Poster</h2><p>A Quiet Jade collection piece built for quiet apartments, reading nooks, deep-work offices, study rooms, and gallery walls. The visual direction leans into smoky jade tones, quiet luxury decor language, kintsugi detail, and deep-work atmosphere instead of generic mass-market wall art.</p><ul><li><strong>Includes:</strong> One 12x18 premium matte vertical poster.</li><li><strong>Material:</strong> Premium matte paper wall art produced on demand through Printify.</li><li><strong>Style:</strong> Academia collector aesthetic; smoky jade, wabi-sabi, scholar-room mood.</li><li><strong>Best For:</strong> apartment decor, reading nook styling, focused workspaces, collectors, and giftable room accents.</li></ul><p><strong>Image Note:</strong> The main image shows the physical product customers receive. Additional gallery images are concept, detail, or collection-reference views and are not extra products or selectable variations.</p><p><strong>Search Themes:</strong> Mystic Threshold Infinite Knowledge, Smoky Jade, Quiet Luxury Decor, Deep Work Visuals, Reading Nook Decor, Wabi Sabi Decor, Scholar Room, Apartment Decor, Jade Art, Kintsugi Aesthetic, Collector Gift, Dark Study Decor, Library Wall Art</p><p><small>Reference SKU: Poster-Academia-0008; Subject: Mystic Threshold Infinite Knowledge</small></p>",$34.99
2026-05-07 00:46:18 -0400,Poster-Academia-0009,69f8547125819cdf3d05522b,406903209258,Dark Academia Sanctum Gate of Preserved Wisdom 12x18 Poster Study Decor Wall,"<h2>Sanctum Gate of Preserved Wisdom – Dark Academia Poster</h2><p>Step into a chamber of ancient knowledge with this 12x18 poster featuring a sanctified gate of moonstone and imperial jade, guarded by consecrated calfskin tomes and floating brass seal fragments. The composition channels mentor-grade dark academia, with ink-wash clouds and a soft jade radiance that evokes preserved wisdom and intellectual reverence.</p><p>Printed on premium semi-gloss poster paper, this piece is ideal for a study desk, library wall, or reading nook. The cinematic chiaroscuro and micro-engraved surface details bring a museum-quality feel to any space, making it a thoughtful gift for book lovers, students, and collectors of vintage scholarly art.</p><ul><li><strong>Includes:</strong> One 12x18 poster (unframed)</li><li><strong>Material:</strong> Premium semi-gloss poster paper (200 gsm)</li><li><strong>Size:</strong> 12 x 18 inches (30.5 x 45.7 cm)</li><li><strong>Style:</strong> Dark Academia, Mentor-Grade</li><li><strong>DNA Profile:</strong> Moonstone, Imperial Jade, Ancient Calfskin, Burnished Brass, Ink-wash Nebula, preservation glyphs, sacred radiance, micro-engraved relief, layered depth, subtle bioluminescent glow</li><li><strong>Use Cases:</strong> Study room wall art, library decor, vintage intellectual gift, student dorm accent, home office inspiration</li></ul><p><strong>Image Note:</strong> The main image shows the actual product customers receive. Additional images are bonus concept/detail reference images and do not represent extra products or selectable variations.</p><p><em>Image Note:</em>",$34.99,Wabi Sabi Study Print Sanctum Gate of Preserved Wisdom 12x18 Matte Poster Decor,"<h2>Wabi Sabi Study Print Sanctum Gate of Preserved Wisdom 12x18 Matte Poster Decor</h2><p>A Quiet Jade collection piece built for quiet apartments, reading nooks, deep-work offices, study rooms, and gallery walls. The visual direction leans into smoky jade tones, quiet luxury decor language, kintsugi detail, and deep-work atmosphere instead of generic mass-market wall art.</p><ul><li><strong>Includes:</strong> One 12x18 premium matte vertical poster.</li><li><strong>Material:</strong> Premium matte paper wall art produced on demand through Printify.</li><li><strong>Style:</strong> Academia collector aesthetic; smoky jade, wabi-sabi, scholar-room mood.</li><li><strong>Best For:</strong> apartment decor, reading nook styling, focused workspaces, collectors, and giftable room accents.</li></ul><p><strong>Image Note:</strong> The main image shows the physical product customers receive. Additional gallery images are concept, detail, or collection-reference views and are not extra products or selectable variations.</p><p><strong>Search Themes:</strong> Sanctum Gate of Preserved Wisdom, Smoky Jade, Quiet Luxury Decor, Deep Work Visuals, Reading Nook Decor, Wabi Sabi Decor, Scholar Room, Apartment Decor, Jade Art, Kintsugi Aesthetic, Collector Gift, Dark Study Decor, Library Wall Art</p><p><small>Reference SKU: Poster-Academia-0009; Subject: Sanctum Gate of Preserved Wisdom</small></p>",$34.99
2026-05-07 00:46:18 -0400,Poster-Academia-0010,69f854ed09f3b7302401ed2e,406903249496,Dark Academia Hermetic Portal of Ancient Codices 12x18 Poster Study Decor Wall,"<p>Step into a sealed vault of forgotten knowledge with this mentor-grade poster, where a hermetic portal of enigmatic moonstone and imperial jade frames a codex collection of ancient calfskin volumes. Floating brass cipher fragments and ink-wash clouds evoke the intellectual mystique of dark academia, making this 12x18 print an essential artifact for the discerning scholar.</p><p>Perfect for adorning a study desk, library wall, or reading nook, this poster transforms any space into a sanctuary of vintage wisdom. The cinematic chiaroscuro lighting and ultra-detailed surface relief ensure a premium collectible aesthetic that rewards close inspection.</p><ul><li><strong>Includes:</strong> One 12x18 poster print</li><li><strong>Material:</strong> Premium matte paper with archival-grade inks</li><li><strong>Size:</strong> 12x18 inches (30.5x45.7 cm)</li><li><strong>Style:</strong> Academia Mentor-Grade — dark academia hermetic with moonstone, imperial jade, calfskin, burnished brass, and ink-wash nebula</li><li><strong>DNA Profile:</strong> Enigmatic moonstone portal, sealed codex vault, floating brass ciphers, hermetic formulae, micro-engraved relief, kintsugi-like vein logic, internal bioluminescent glow, centered composition on white background</li><li><strong>Use Cases:</strong> Study room wall art, library decor, book lover gift, student dorm inspiration, vintage intellectual aesthetic, collector’s display</li></ul><p><strong>Image Note:</strong> The main image shows the actual product customers receive. Additional images are bonus concept/detail reference images and do not represent extra products or selectable variations.</p><p><em>Image Note: </em></p>",$34.99,Quiet Luxury Apartment Art Hermetic Portal of Ancient Codices 12x18 Matte Decor,"<h2>Quiet Luxury Apartment Art Hermetic Portal of Ancient Codices 12x18 Matte Decor</h2><p>A Quiet Jade collection piece built for quiet apartments, reading nooks, deep-work offices, study rooms, and gallery walls. The visual direction leans into smoky jade tones, quiet luxury decor language, kintsugi detail, and deep-work atmosphere instead of generic mass-market wall art.</p><ul><li><strong>Includes:</strong> One 12x18 premium matte vertical poster.</li><li><strong>Material:</strong> Premium matte paper wall art produced on demand through Printify.</li><li><strong>Style:</strong> Academia collector aesthetic; smoky jade, wabi-sabi, scholar-room mood.</li><li><strong>Best For:</strong> apartment decor, reading nook styling, focused workspaces, collectors, and giftable room accents.</li></ul><p><strong>Image Note:</strong> The main image shows the physical product customers receive. Additional gallery images are concept, detail, or collection-reference views and are not extra products or selectable variations.</p><p><strong>Search Themes:</strong> Hermetic Portal of Ancient Codices, Smoky Jade, Quiet Luxury Decor, Deep Work Visuals, Reading Nook Decor, Wabi Sabi Decor, Scholar Room, Apartment Decor, Jade Art, Kintsugi Aesthetic, Collector Gift, Dark Study Decor, Library Wall Art</p><p><small>Reference SKU: Poster-Academia-0010; Subject: Hermetic Portal of Ancient Codices</small></p>",$34.99
