Timestamp,ID,Printify_Product_ID,eBay_Item_ID,Old_Title,Old_Description,Old_Price,New_Title,New_Description,New_Price
2026-05-07 00:46:18 -0400,Poster-Academia-0011,69f850b425819cdf3d054e10,406903250376,Dark Academia Celestial Archway Poster 12x18 Study Room Decor Timeless Tomes,"<p>Step into a cosmic library where a celestial archway of stellar moonstone and imperial jade rises before an eternal repository of timeless tomes. This dark academia poster captures the essence of intellectual wonder, with calfskin manuscripts swirling through a starfield atmosphere and brass constellation fragments etched with stellar coordinates. The ink-wash clouds and jade luminosity create a moody, vintage aesthetic perfect for book lovers and scholars.</p><p>Printed on premium matte paper, this 12x18 poster brings a mentor-grade artifact design to your study desk, home library, or reading nook. The ultra-detailed moonstone shimmer and brass celestial details offer a daily dose of inspiration for students, collectors, or anyone drawn to the romance of knowledge and the cosmos. Ideal as a gift for the intellectual in your life or as a focal point in a minimalist study space.</p><ul><li><strong>Includes:</strong> One 12x18 poster, ready to frame</li><li><strong>Material:</strong> Premium matte paper, 200 gsm</li><li><strong>Size:</strong> 12 inches by 18 inches (30.5 x 45.7 cm)</li><li><strong>Style:</strong> Dark academia, celestial, vintage intellectual</li><li><strong>DNA Profile:</strong> Celestial archway, moonstone, imperial jade, calfskin manuscripts, brass constellations, ink-wash starfield, jade luminosity, eternal tomes, dark academia aesthetic, mentor-grade artifact</li><li><strong>Use Cases:</strong> Study decor, library wall art, book lover gift, student room accent, vintage-inspired home office</li></ul><p><strong>Image Note:</strong> The main image shows the actual product customers receive. Additional images are bonus concept/detail reference images and do not represent extra products or selectable variations.</p>",$34.99,Deep Work Visual Poster Celestial Archway Timeless Tomes 12x18 Matte Poster,"<h2>Deep Work Visual Poster Celestial Archway Timeless Tomes 12x18 Matte Poster</h2><p>A Quiet Jade collection piece built for quiet apartments, reading nooks, deep-work offices, study rooms, and gallery walls. The visual direction leans into smoky jade tones, quiet luxury decor language, kintsugi detail, and deep-work atmosphere instead of generic mass-market wall art.</p><ul><li><strong>Includes:</strong> One 12x18 premium matte vertical poster.</li><li><strong>Material:</strong> Premium matte paper wall art produced on demand through Printify.</li><li><strong>Style:</strong> Academia collector aesthetic; smoky jade, wabi-sabi, scholar-room mood.</li><li><strong>Best For:</strong> apartment decor, reading nook styling, focused workspaces, collectors, and giftable room accents.</li></ul><p><strong>Image Note:</strong> The main image shows the physical product customers receive. Additional gallery images are concept, detail, or collection-reference views and are not extra products or selectable variations.</p><p><strong>Search Themes:</strong> Celestial Archway Timeless Tomes, Smoky Jade, Quiet Luxury Decor, Deep Work Visuals, Reading Nook Decor, Wabi Sabi Decor, Scholar Room, Apartment Decor, Jade Art, Kintsugi Aesthetic, Collector Gift, Dark Study Decor, Library Wall Art</p><p><small>Reference SKU: Poster-Academia-0011; Subject: Celestial Archway Timeless Tomes</small></p>",$34.99
2026-05-07 00:46:18 -0400,Poster-Academia-0013,69f855abffbc831dea0847c8,406903251282,Dark Academia Alchemist Threshold Transmuted Knowledge 12x18 Poster Study Decor,"<p>Step into a transmutation sanctum with this mentor-grade dark academia poster, where alchemical moonstone and imperial jade forge a gateway to ancient wisdom. The composition evokes a threshold of transmuted knowledge, blending ink-wash alchemical clouds with levitating brass formula fragments. This piece is designed for the intellectual soul who finds beauty in mystical chemistry and formulary collections.</p><p>Perfect for a study desk, library wall, or reading nook, this 12x18 poster brings a cinematic chiaroscuro atmosphere to any space. The ultra-detailed moonstone crystallization and burnished brass mechanisms offer a hyper-detailed artifact aesthetic, making it a compelling focal point for book lovers and students of the arcane. Use it to enhance a vintage-inspired decor or as a gift for the alchemist in your life.</p><ul><li><strong>Includes:</strong> One 12x18 poster, ready to frame</li><li><strong>Material:</strong> Premium matte paper, archival quality</li><li><strong>Size:</strong> 12 inches by 18 inches</li><li><strong>Style:</strong> Dark Academia, Mentor-Grade Alchemy</li><li><strong>DNA Profile:</strong> Alchemical moonstone, imperial jade, ancient calfskin, burnished brass, ink-wash nebula, micro-engraved surface relief, handcrafted edge bevels, layered translucent depth, subtle internal bioluminescent glow, refined kintsugi-like vein logic, floating accent fragments with intentional negative space, cinematic rim lighting plus soft museum-grade overhead fill, crisp silhouette readability, centered premium product composition, clean contour separation, high-end collectible artifact aesthetic, isolated on white background</li><li><strong>Use Cases:</strong> Study desk decor, library wall art, vintage intellectual gift, student room accent, alchemy enthusiast collection</li></ul><p><strong>Image Note:</strong> The main image shows the actual product customers receive. Additional images are bonus concept/detail reference images and do not represent extra products or selectable variations.</p><p><em>Image Note: </em></p>",$34.99,Wabi Sabi Study Print Alchemist Threshold Transmuted Knowledge 12x18 Matte Gift,"<h2>Wabi Sabi Study Print Alchemist Threshold Transmuted Knowledge 12x18 Matte Gift</h2><p>A Quiet Jade collection piece built for quiet apartments, reading nooks, deep-work offices, study rooms, and gallery walls. The visual direction leans into smoky jade tones, quiet luxury decor language, kintsugi detail, and deep-work atmosphere instead of generic mass-market wall art.</p><ul><li><strong>Includes:</strong> One 12x18 premium matte vertical poster.</li><li><strong>Material:</strong> Premium matte paper wall art produced on demand through Printify.</li><li><strong>Style:</strong> Academia collector aesthetic; smoky jade, wabi-sabi, scholar-room mood.</li><li><strong>Best For:</strong> apartment decor, reading nook styling, focused workspaces, collectors, and giftable room accents.</li></ul><p><strong>Image Note:</strong> The main image shows the physical product customers receive. Additional gallery images are concept, detail, or collection-reference views and are not extra products or selectable variations.</p><p><strong>Search Themes:</strong> Alchemist Threshold Transmuted Knowledge, Smoky Jade, Quiet Luxury Decor, Deep Work Visuals, Reading Nook Decor, Wabi Sabi Decor, Scholar Room, Apartment Decor, Jade Art, Kintsugi Aesthetic, Collector Gift, Dark Study Decor, Library Wall Art</p><p><small>Reference SKU: Poster-Academia-0013; Subject: Alchemist Threshold Transmuted Knowledge</small></p>",$34.99
2026-05-07 00:46:18 -0400,Poster-Academia-0083,69f2a1b8a7777da197101a96,406902669660,Academia Mentor-Grade Cosmic Lotus Observatory 12x18 Poster Steampunk Study,"<p>This poster transforms your study or library into a sanctuary of celestial wonder. The Cosmic Lotus Observatory merges botanical precision with astronomical mystique, featuring a mechanical lotus whose brass petals unfold to reveal crystalline star charts. A translucent amber core glows with golden stardust, while each petal is engraved with zodiac symbols and planetary orbits. Warm academic lighting and aged brass textures evoke a museum-grade artifact, perfect for dark academia interiors.</p><p>Printed on premium matte paper, this 12x18 vertical poster is ideal for framing and display above a study desk, in a reading nook, or as part of a gallery wall. The edge-to-edge composition ensures immersive visual impact, while the refined handcrafted edge bevels add a tactile, collectible quality. Use it to inspire intellectual reflection or as a distinctive gift for astronomy enthusiasts, book lovers, and steampunk aficionados.</p><ul><li><strong>Includes:</strong> One 12x18 poster (unframed)</li><li><strong>Material:</strong> Premium matte paper, museum-grade finish</li><li><strong>Size:</strong> 12 inches by 18 inches (vertical orientation)</li><li><strong>Style:</strong> Academia Mentor-Grade, dark academia, steampunk botanical, celestial</li><li><strong>DNA Profile:</strong> Mechanical lotus, brass petals, crystalline star charts, amber core, golden stardust, zodiac engravings, planetary orbits, warm academic lighting, aged brass, kintsugi veins, bioluminescent glow, edge-to-edge composition</li><li><strong>Use Cases:</strong> Study decor, library wall art, academic gift, astrology lover present, steampunk room accent, vintage intellectual display</li></ul><p><strong>Image Note:</strong> The main image shows the actual product customers receive. Additional images are bonus concept/detail reference images and do not represent extra products or selectable variations.</p><p><em>Image Note: </em></p>",$34.99,Quiet Luxury Apartment Art Cosmic Lotus Observatory Steampunk 12x18 Matte Decor,"<h2>Quiet Luxury Apartment Art Cosmic Lotus Observatory Steampunk 12x18 Matte Decor</h2><p>A Quiet Jade collection piece built for quiet apartments, reading nooks, deep-work offices, study rooms, and gallery walls. The visual direction leans into smoky jade tones, quiet luxury decor language, kintsugi detail, and deep-work atmosphere instead of generic mass-market wall art.</p><ul><li><strong>Includes:</strong> One 12x18 premium matte vertical poster.</li><li><strong>Material:</strong> Premium matte paper wall art produced on demand through Printify.</li><li><strong>Style:</strong> Academia collector aesthetic; smoky jade, wabi-sabi, scholar-room mood.</li><li><strong>Best For:</strong> apartment decor, reading nook styling, focused workspaces, collectors, and giftable room accents.</li></ul><p><strong>Image Note:</strong> The main image shows the physical product customers receive. Additional gallery images are concept, detail, or collection-reference views and are not extra products or selectable variations.</p><p><strong>Search Themes:</strong> Cosmic Lotus Observatory Steampunk, Smoky Jade, Quiet Luxury Decor, Deep Work Visuals, Reading Nook Decor, Wabi Sabi Decor, Scholar Room, Apartment Decor, Jade Art, Kintsugi Aesthetic, Collector Gift, Dark Study Decor, Library Wall Art</p><p><small>Reference SKU: Poster-Academia-0083; Subject: Cosmic Lotus Observatory Steampunk</small></p>",$34.99
2026-05-07 00:46:18 -0400,Poster-Academia-0084,69f2a2aacaeb1241880b9f6b,406902691983,Astrolabe Chalice Relic Dark Academia Poster 12x18 Vintage Study Decor Wall,"<p>This <b>Astrolabe Chalice Relic</b> poster captures a ceremonial astronomy vessel in the Academia Mentor-Grade style. The image presents an ancient brass chalice with astrolabe mechanisms, translucent amber cup, and glowing star maps, evoking intellectual mystery and antique ritual design.</p><p>Ideal for a study desk, library wall, or book lover's retreat, this 12x18 print brings vintage scholarly atmosphere to any room. The premium matte finish and cinematic lighting enhance the deep amber tones and celestial details, making it a striking focal point for dark academia interiors.</p><ul><li><b>Includes:</b> One 12x18 poster (vertical orientation)</li><li><b>Material:</b> Premium matte paper, archival quality</li><li><b>Size:</b> 12 inches by 18 inches (2:3 aspect ratio)</li><li><b>Style:</b> Academia Mentor-Grade, dark academia, vintage intellectual</li><li><b>DNA Profile:</b> Astrolabe chalice, brass rim with celestial coordinates, rotating zodiac rings, crystalline charts, golden stardust, amber translucency, bioluminescent glow, handcrafted edge bevels, floating fragments</li><li><b>Use Cases:</b> Wall art for study, library, home office; gift for astronomy enthusiasts, history buffs, students, professors; decor for academic-themed spaces</li></ul><p><strong>Image Note:</strong> The main image shows the actual product customers receive. Additional images are bonus concept/detail reference images and do not represent extra products or selectable variations.</p><p><i>Image Note:</i>",$34.99,Deep Work Visual Poster Astrolabe Chalice Relic Vintage 12x18 Matte Poster Gift,"<h2>Deep Work Visual Poster Astrolabe Chalice Relic Vintage 12x18 Matte Poster Gift</h2><p>A Quiet Jade collection piece built for quiet apartments, reading nooks, deep-work offices, study rooms, and gallery walls. The visual direction leans into smoky jade tones, quiet luxury decor language, kintsugi detail, and deep-work atmosphere instead of generic mass-market wall art.</p><ul><li><strong>Includes:</strong> One 12x18 premium matte vertical poster.</li><li><strong>Material:</strong> Premium matte paper wall art produced on demand through Printify.</li><li><strong>Style:</strong> Academia collector aesthetic; smoky jade, wabi-sabi, scholar-room mood.</li><li><strong>Best For:</strong> apartment decor, reading nook styling, focused workspaces, collectors, and giftable room accents.</li></ul><p><strong>Image Note:</strong> The main image shows the physical product customers receive. Additional gallery images are concept, detail, or collection-reference views and are not extra products or selectable variations.</p><p><strong>Search Themes:</strong> Astrolabe Chalice Relic Vintage, Smoky Jade, Quiet Luxury Decor, Deep Work Visuals, Reading Nook Decor, Wabi Sabi Decor, Scholar Room, Apartment Decor, Jade Art, Kintsugi Aesthetic, Collector Gift, Dark Study Decor, Library Wall Art</p><p><small>Reference SKU: Poster-Academia-0084; Subject: Astrolabe Chalice Relic Vintage</small></p>",$34.99
2026-05-07 00:46:18 -0400,Poster-Academia-0091,69f2b7ada7777da1971028d7,406902887127,Dark Academia Celestial Lotus Poster 12x18 Vintage Study Room Wall Art Decor,"<p>This poster presents a meticulously imagined mechanical lotus bloom, its petals carved from translucent jade and moonstone glass, rotating around a brass gear core with copper wire stamens. Ink-wash constellation patterns and floating talisman paper fragments orbit the flower, all illuminated by soft candlelight. The composition is a museum-grade, cinematic vertical piece that evokes the depth of an antique glass orrery and the mystery of an oriental botanical study.</p><p>Printed on premium matte paper, this 12x18 poster is ideal for a study desk, library wall, or reading nook. The rich, layered translucency and handcrafted edge bevels of the imagined glasswork translate into a high-contrast, immersive visual experience. Use it to anchor a dark academia gallery wall or as a focal point above a vintage desk.</p><ul><li><strong>Includes:</strong> One 12x18 premium matte poster (unframed)</li><li><strong>Material:</strong> Premium matte paper with archival-grade ink</li><li><strong>Size:</strong> 12x18 inches (vertical orientation)</li><li><strong>Style:</strong> Academia Mentor-Grade, dark academia, celestial botanical, mechanical sculpture</li><li><strong>DNA Profile:</strong> Imperial jade, moonstone glass, brass gear, copper wire, talisman paper, ink-wash constellations, hand-blown glass dewdrops, kintsugi-like vein logic, floating fragments, soft candlelight illumination</li><li><strong>Use Cases:</strong> Study room decor, library wall art, vintage office accent, book lover gift, student dorm inspiration, intellectual home aesthetic</li></ul><p><strong>Image Note:</strong> The main image shows the actual product customers receive. Additional images are bonus concept/detail reference images and do not represent extra products or selectable variations.</p><p><em>Image Note: </em></p>",$34.99,Smoky Jade Wall Art Celestial Lotus Vintage 12x18 Matte Poster Apartment Decor,"<h2>Smoky Jade Wall Art Celestial Lotus Vintage 12x18 Matte Poster Apartment Decor</h2><p>A Quiet Jade collection piece built for quiet apartments, reading nooks, deep-work offices, study rooms, and gallery walls. The visual direction leans into smoky jade tones, quiet luxury decor language, kintsugi detail, and deep-work atmosphere instead of generic mass-market wall art.</p><ul><li><strong>Includes:</strong> One 12x18 premium matte vertical poster.</li><li><strong>Material:</strong> Premium matte paper wall art produced on demand through Printify.</li><li><strong>Style:</strong> Academia collector aesthetic; smoky jade, wabi-sabi, scholar-room mood.</li><li><strong>Best For:</strong> apartment decor, reading nook styling, focused workspaces, collectors, and giftable room accents.</li></ul><p><strong>Image Note:</strong> The main image shows the physical product customers receive. Additional gallery images are concept, detail, or collection-reference views and are not extra products or selectable variations.</p><p><strong>Search Themes:</strong> Celestial Lotus Vintage, Smoky Jade, Quiet Luxury Decor, Deep Work Visuals, Reading Nook Decor, Wabi Sabi Decor, Scholar Room, Apartment Decor, Jade Art, Kintsugi Aesthetic, Collector Gift, Dark Study Decor, Library Wall Art</p><p><small>Reference SKU: Poster-Academia-0091; Subject: Celestial Lotus Vintage</small></p>",$34.99
2026-05-07 00:46:18 -0400,Poster-Zen-0001,69f2dc76cd8d046051041f06,406902890971,Zen Bonsai Wall Art Celestial Gate of Jade Mist 12x18 Poster Meditation Decor,"<p>Transform your space with the <strong>Celestial Gate of Jade Mist</strong>, a premium vertical poster that captures the serene essence of a miniature floating mountain. This Zen Mentor-Grade artwork features an Imperial Green Jade bonsai tree framed by a luminous Moonstone torii gate, with crystalline waterfalls cascading into clouds above an obsidian rock base. The ink-wash nebula backdrop and floating talisman fragments create an ethereal, balanced composition that evokes mindfulness and tranquility.</p><p>Printed on high-quality matte paper, this 12x18 poster is ideal for a study desk, meditation room, or minimalist living area. Its ultra-wide angle and hyper-detailed design ensure a crisp silhouette and deep visual depth, making it a perfect gift for yoga practitioners, journal enthusiasts, or anyone seeking calm, intellectual decor. The soft morning mist lighting and subtle internal glow bring a refined, handcrafted aesthetic to your wall.</p><ul><li><strong>Includes:</strong> One 12x18 poster (unframed)</li><li><strong>Material:</strong> Premium matte paper with smooth finish</li><li><strong>Size:</strong> 12 inches by 18 inches (vertical orientation)</li><li><strong>Style:</strong> Zen Mentor-Grade with floating mountain, bonsai tree, torii gate, and talisman fragments</li><li><strong>DNA Profile:</strong> Imperial Green Jade, Moonstone, Floating Obsidian, Talisman Fragments; micro-engraved surface relief, handcrafted edge bevels, layered translucent depth, subtle bioluminescent glow, kintsugi-like vein logic, intentional negative space, cinematic rim lighting, museum-grade overhead fill</li><li><strong>Use Cases:</strong> Meditation room decor, study desk accent, yoga studio wall art, minimalist living room, bedroom zen corner, gift for mindfulness enthusiasts</li></ul><p><strong>Image Note:</strong> The main image shows the actual product customers receive. Additional images are bonus concept/detail reference images and do not represent extra products or selectable variations.</p><p><em>Image Note: </em></p>",$34.99,Deep Work Visual Poster Bonsai Celestial Gate of Jade 12x18 Matte Poster Deep,"<h2>Deep Work Visual Poster Bonsai Celestial Gate of Jade 12x18 Matte Poster Deep</h2><p>A Quiet Jade collection piece built for quiet apartments, reading nooks, deep-work offices, study rooms, and gallery walls. The visual direction leans into smoky jade tones, quiet luxury decor language, kintsugi detail, and deep-work atmosphere instead of generic mass-market wall art.</p><ul><li><strong>Includes:</strong> One 12x18 premium matte vertical poster.</li><li><strong>Material:</strong> Premium matte paper wall art produced on demand through Printify.</li><li><strong>Style:</strong> Zen collector aesthetic; smoky jade, wabi-sabi, scholar-room mood.</li><li><strong>Best For:</strong> apartment decor, reading nook styling, focused workspaces, collectors, and giftable room accents.</li></ul><p><strong>Image Note:</strong> The main image shows the physical product customers receive. Additional gallery images are concept, detail, or collection-reference views and are not extra products or selectable variations.</p><p><strong>Search Themes:</strong> Bonsai Celestial Gate of Jade, Smoky Jade, Quiet Luxury Decor, Deep Work Visuals, Reading Nook Decor, Wabi Sabi Decor, Scholar Room, Apartment Decor, Jade Art, Kintsugi Aesthetic, Collector Gift, Meditation Decor, Calm Desk Art</p><p><small>Reference SKU: Poster-Zen-0001; Subject: Bonsai Celestial Gate of Jade</small></p>",$34.99
2026-05-07 00:46:18 -0400,Poster-Zen-0002,69f2cf675f78c14a7b0a894c,406902897663,Dark Academia Phoenix Incense Burner 12x18 Poster Ritual Zen Decor Wall Study,"<p>This 12x18 poster presents a ceremonial incense burner shaped as a rising phoenix, crafted from Imperial Green Jade wings with Moonstone flame accents. Floating obsidian smoke wisps and orbiting talisman fragments create an ethereal, balanced composition that evokes mindfulness and minimalist ritual. The soft morning mist lighting and ultra-wide angle view emphasize the vessel's handcrafted edge bevels and layered translucent depth, making it a meditative focal point for any space.</p><p>Ideal for a study desk, journaling corner, or meditation room, this poster brings a sense of calm and intellectual focus to your environment. The subtle internal bioluminescent glow and refined kintsugi-like vein logic add a museum-quality aesthetic that complements both modern minimalist and dark academia interiors. Whether you are a book lover, student, or collector of ritual objects, this artwork invites quiet contemplation and balance into your daily life.</p><ul><li><strong>Includes:</strong> One 12x18 poster (unframed)</li><li><strong>Material:</strong> Premium matte paper with archival-grade ink</li><li><strong>Size:</strong> 12 x 18 inches (portrait orientation)</li><li><strong>Style:</strong> Zen Mentor-Grade – dark academia, vintage intellectual, minimalist ritual</li><li><strong>DNA Profile:</strong> Imperial Green Jade, Moonstone, Floating Obsidian, Talisman Fragments, handcrafted edge bevels, layered translucent depth, subtle bioluminescent glow, kintsugi vein logic, floating accent fragments with intentional negative space, cinematic rim lighting, museum-grade overhead fill, crisp silhouette readability, centered premium product composition, clean contour separation, high-end collectible artifact aesthetic</li><li><strong>Use Cases:</strong> Wall art for study desk, meditation room, living room, library, journaling nook, or as a gift for book lovers, students, and zen enthusiasts</li></ul><p><strong>Image Note:</strong> The main image shows the actual product customers receive. Additional images are bonus concept/detail reference images and do not represent extra products or selectable variations.</p><p><em>Image Note: </em></p>",$34.99,Reading Nook Wall Decor Phoenix Incense Burner Ritual 12x18 Matte Poster Gift,"<h2>Reading Nook Wall Decor Phoenix Incense Burner Ritual 12x18 Matte Poster Gift</h2><p>A Quiet Jade collection piece built for quiet apartments, reading nooks, deep-work offices, study rooms, and gallery walls. The visual direction leans into smoky jade tones, quiet luxury decor language, kintsugi detail, and deep-work atmosphere instead of generic mass-market wall art.</p><ul><li><strong>Includes:</strong> One 12x18 premium matte vertical poster.</li><li><strong>Material:</strong> Premium matte paper wall art produced on demand through Printify.</li><li><strong>Style:</strong> Zen collector aesthetic; smoky jade, wabi-sabi, scholar-room mood.</li><li><strong>Best For:</strong> apartment decor, reading nook styling, focused workspaces, collectors, and giftable room accents.</li></ul><p><strong>Image Note:</strong> The main image shows the physical product customers receive. Additional gallery images are concept, detail, or collection-reference views and are not extra products or selectable variations.</p><p><strong>Search Themes:</strong> Phoenix Incense Burner Ritual, Smoky Jade, Quiet Luxury Decor, Deep Work Visuals, Reading Nook Decor, Wabi Sabi Decor, Scholar Room, Apartment Decor, Jade Art, Kintsugi Aesthetic, Collector Gift, Meditation Decor, Calm Desk Art</p><p><small>Reference SKU: Poster-Zen-0002; Subject: Phoenix Incense Burner Ritual</small></p>",$34.99
