Timestamp,ID,Printify_Product_ID,eBay_Item_ID,Old_Title,Old_Description,Old_Price,New_Title,New_Description,New_Price
2026-05-07 00:46:18 -0400,Acrylic-Zen-0005,69f2c22e9b469f716d0ea954,406902893289,Zen Incense Vessel Constellation 5x7 Acrylic Block for Meditation Desk Shelf,"<p>This incense vessel constellation acrylic block transforms a celestial ritual artifact into a luminous 5x7 display piece. The design features a moonstone sphere with jade segments, aquamarine vents, and a clockwork brass lid, all rendered in a zen mentor-grade style. Soft bioluminescent glow and floating talisman fragments evoke balance and mindfulness, making it ideal for a meditation desk or minimalist workspace.</p><p>Use this acrylic block as a desktop focal point for daily reflection, a unique gift for a zen practitioner, or a refined accent on a bookshelf or altar. The transparent material allows light to pass through, enhancing the internal glow and refractive details. Its compact size fits easily on a laptop stand, journal table, or water bottle shelf, adding a touch of celestial calm to any room.</p><ul><li><strong>Includes:</strong> One 5x7 acrylic block with full-color print on premium clear substrate</li><li><strong>Material:</strong> High-gloss acrylic with UV-resistant ink for lasting vibrancy</li><li><strong>Size:</strong> 5x7 inches (portrait orientation)</li><li><strong>Style:</strong> Zen Mentor-Grade with celestial and clockwork motifs</li><li><strong>DNA Profile:</strong> Moonstone sphere, imperial jade segments, aquamarine vents, clockwork brass lid, rotating celestial patterns, bioluminescent glow, ink-wash nebula vapor, floating talisman fragments, micro-engraved relief, kintsugi-like vein logic, negative space composition, museum-grade lighting</li><li><strong>Use Cases:</strong> Meditation desk decor, zen gift for mindfulness lovers, altar accent, minimalist office ornament, journaling companion, water bottle shelf display</li></ul><p><strong>Image Note:</strong> The main image shows the actual product customers receive. Additional images are bonus concept/detail reference images and do not represent extra products or selectable variations.</p><p><em>Image Note: </em></p>",$89.99,Gallery Desk Art Incense Vessel Constellation for Meditation 5x7 Acrylic Photo,"<h2>Gallery Desk Art Incense Vessel Constellation for Meditation 5x7 Acrylic Photo</h2><p>A Quiet Jade collection piece built for desks, bookshelves, altar corners, office focus spaces, and collector displays. The visual direction leans into smoky jade tones, quiet luxury decor language, kintsugi detail, and deep-work atmosphere instead of generic mass-market wall art.</p><ul><li><strong>Includes:</strong> One 5x7 vertical acrylic photo block.</li><li><strong>Material:</strong> Acrylic block display with depth, gloss, and light-reflective finish.</li><li><strong>Style:</strong> Zen collector aesthetic; smoky jade, wabi-sabi, scholar-room mood.</li><li><strong>Best For:</strong> apartment decor, reading nook styling, focused workspaces, collectors, and giftable room accents.</li></ul><p><strong>Image Note:</strong> The main image shows the physical product customers receive. Additional gallery images are concept, detail, or collection-reference views and are not extra products or selectable variations.</p><p><strong>Search Themes:</strong> Incense Vessel Constellation for Meditat, Smoky Jade, Quiet Luxury Decor, Deep Work Visuals, Reading Nook Decor, Wabi Sabi Decor, Scholar Room, Apartment Decor, Jade Art, Kintsugi Aesthetic, Collector Gift, Meditation Decor, Calm Desk Art</p><p><small>Reference SKU: Acrylic-Zen-0005; Subject: Incense Vessel Constellation for Meditation</small></p>",$89.99
2026-05-07 00:46:18 -0400,Acrylic-Zen-0007,69f2d3ab5f78c14a7b0a8b87,406903028253,Zen Aesthetic Sacred Lotus Meditation Bell 5x7 Acrylic Block for Altar Decor,"<p>Elevate your sacred space with the Sacred Lotus Meditation Bell, a Zen mentor-grade acrylic block that captures the essence of ancient bronze ritual instruments and celestial serenity. This 5x7 translucent print brings a museum-quality bell sculpture to life, featuring a blooming lotus form with a rough raku pottery clapper, moonstone dewdrops, and an imperial jade stem wrapped in silk cord. The design incorporates ink-wash sound wave ripples and floating prayer beads, all glowing with a soft bioluminescent aura against a misty bamboo forest backdrop. Perfect for meditation altars, minimalist desks, or mindfulness corners, this piece transforms any room into a sanctuary of calm and balance.</p><p>Printed on premium acrylic, this block offers exceptional depth and refractive light, with a 3D relief effect that mimics handcrafted kintsugi vein details and micro-engraved surfaces. The solid white background ensures crisp silhouette readability, while the internal glow adds a subtle celestial ambiance. Use it as a decorative accent on a bookshelf, a focal point for yoga practice, or a thoughtful gift for a meditation enthusiast. Its compact size fits seamlessly into small spaces, making it ideal for apartments, offices, or dorm rooms.</p><ul><li><strong>Includes:</strong> One 5x7 acrylic block with printed design</li><li><strong>Material:</strong> High-quality clear acrylic with UV-resistant ink</li><li><strong>Size:</strong> 5x7 inches (12.7 x 17.8 cm)</li><li><strong>Style:</strong> Zen Mentor-Grade, minimalist, bioluminescent</li><li><strong>DNA Profile:</strong> Ancient bronze bell, raku pottery, moonstone, imperial jade, ink-wash nebula, prayer beads, kintsugi detail, celestial glow</li><li><strong>Use Cases:</strong> Meditation altar decor, desk accent, yoga room art, mindfulness gift, zen home decor, bookshelf display, study inspiration</li></ul><p><strong>Image Note:</strong> The main image shows the actual product customers receive. Additional images are bonus concept/detail reference images and do not represent extra products or selectable variations.</p><p><em>Image Note:</em>",$89.99,Quiet Luxury Shelf Decor Sacred Lotus Meditation Bell for 5x7 Acrylic Photo,"<h2>Quiet Luxury Shelf Decor Sacred Lotus Meditation Bell for 5x7 Acrylic Photo</h2><p>A Quiet Jade collection piece built for desks, bookshelves, altar corners, office focus spaces, and collector displays. The visual direction leans into smoky jade tones, quiet luxury decor language, kintsugi detail, and deep-work atmosphere instead of generic mass-market wall art.</p><ul><li><strong>Includes:</strong> One 5x7 vertical acrylic photo block.</li><li><strong>Material:</strong> Acrylic block display with depth, gloss, and light-reflective finish.</li><li><strong>Style:</strong> Zen collector aesthetic; smoky jade, wabi-sabi, scholar-room mood.</li><li><strong>Best For:</strong> apartment decor, reading nook styling, focused workspaces, collectors, and giftable room accents.</li></ul><p><strong>Image Note:</strong> The main image shows the physical product customers receive. Additional gallery images are concept, detail, or collection-reference views and are not extra products or selectable variations.</p><p><strong>Search Themes:</strong> Sacred Lotus Meditation Bell for, Smoky Jade, Quiet Luxury Decor, Deep Work Visuals, Reading Nook Decor, Wabi Sabi Decor, Scholar Room, Apartment Decor, Jade Art, Kintsugi Aesthetic, Collector Gift, Meditation Decor, Calm Desk Art</p><p><small>Reference SKU: Acrylic-Zen-0007; Subject: Sacred Lotus Meditation Bell for</small></p>",$89.99
2026-05-07 00:46:18 -0400,Acrylic-Zen-0008,69f2d49b81039eb9ab0b583c,406903036452,Zen Celestial Bonsai Moon Garden 5x7 Acrylic Block for Serene Desk Decor Shelf,"<p>Bring celestial calm to your space with this Zen Mentor-Grade acrylic block, featuring a miniature bonsai tree growing from a crescent moon raku vessel. Twisted imperial jade wire branches and moonstone blossoms glow against ink-wash nebula soil, creating a museum-quality meditation focal point.</p><p>This 5x7 acrylic print transforms your desk, shelf, or altar into a minimalist sanctuary. The translucent block captures soft light, enhancing the bioluminescent details and kintsugi vein accents. Perfect for mindfulness breaks, journaling sessions, or as a water bottle companion in your zen corner.</p><ul><li><strong>Includes:</strong> One 5x7 acrylic block with built-in easel stand</li><li><strong>Material:</strong> Premium clear acrylic with UV-resistant print</li><li><strong>Size:</strong> 5x7 inches (12.7 x 17.8 cm)</li><li><strong>Style:</strong> Zen Mentor-Grade – celestial bonsai, raku pottery vessel, jade wire branches, moonstone blossoms, nebula soil</li><li><strong>DNA Profile:</strong> Celestial Bonsai Moon Garden – crescent moon vessel, imperial jade branches, moonstone blossom tree, raku pottery planter, luminous nebula soil, floating lantern fragments, translucent root system, zen garden miniature, bioluminescent botanical art, kintsugi vessel detail, museum-grade bonsai object, handcrafted jade wire, premium acrylic composition</li><li><strong>Use Cases:</strong> Laptop desk decor, journaling companion, water bottle table accent, meditation altar, bookshelf display, mindfulness gift</li></ul><p><strong>Image Note:</strong> The main image shows the actual product customers receive. Additional images are bonus concept/detail reference images and do not represent extra products or selectable variations.</p><p><em>Image Note: </em></p>",$89.99,Deep Work Desk Visual Celestial Bonsai Moon Garden for 5x7 Acrylic Photo Block,"<h2>Deep Work Desk Visual Celestial Bonsai Moon Garden for 5x7 Acrylic Photo Block</h2><p>A Quiet Jade collection piece built for desks, bookshelves, altar corners, office focus spaces, and collector displays. The visual direction leans into smoky jade tones, quiet luxury decor language, kintsugi detail, and deep-work atmosphere instead of generic mass-market wall art.</p><ul><li><strong>Includes:</strong> One 5x7 vertical acrylic photo block.</li><li><strong>Material:</strong> Acrylic block display with depth, gloss, and light-reflective finish.</li><li><strong>Style:</strong> Zen collector aesthetic; smoky jade, wabi-sabi, scholar-room mood.</li><li><strong>Best For:</strong> apartment decor, reading nook styling, focused workspaces, collectors, and giftable room accents.</li></ul><p><strong>Image Note:</strong> The main image shows the physical product customers receive. Additional gallery images are concept, detail, or collection-reference views and are not extra products or selectable variations.</p><p><strong>Search Themes:</strong> Celestial Bonsai Moon Garden for, Smoky Jade, Quiet Luxury Decor, Deep Work Visuals, Reading Nook Decor, Wabi Sabi Decor, Scholar Room, Apartment Decor, Jade Art, Kintsugi Aesthetic, Collector Gift, Meditation Decor, Calm Desk Art</p><p><small>Reference SKU: Acrylic-Zen-0008; Subject: Celestial Bonsai Moon Garden for</small></p>",$89.99
2026-05-07 00:46:18 -0400,Acrylic-Zen-0009,69f80f8a83a8608fd80ec283,406903047385,"Zen Bamboo Flute 5x7 Acrylic Block, Whispering Shakuhachi Meditation Art Gift","<p>This 5x7 acrylic block captures the ethereal spirit of a floating shakuhachi bamboo flute, rendered in warm honey tones with natural nodes and grain texture. Ethereal mist spirals from the mouthpiece, forming delicate kanji characters above a contemplative zen garden arrangement. The design embodies Zen Mentor-Grade aesthetics—calm, balance, and mindfulness—making it a refined focal point for any meditation space or minimalist interior.</p><p>Place this premium acrylic photo block on your study desk, bookshelf, or altar to invite tranquility into daily life. The 3D relief effect and subtle internal bioluminescent glow create a museum-grade collectible that shifts with ambient light. Perfect as a contemplative gift for musicians, meditation practitioners, or lovers of Japanese bamboo instrument art.</p><ul><li><strong>Includes:</strong> One 5x7 acrylic block with easel back stand</li><li><strong>Material:</strong> High-clarity acrylic with UV-resistant print, 3D relief depth</li><li><strong>Size:</strong> 5x7 inches (vertical orientation)</li><li><strong>Style:</strong> Zen Mentor-Grade—aged bamboo, honey tones, jade vapor, morning light</li><li><strong>DNA Profile:</strong> Floating shakuhachi flute with bamboo grain texture, mist-formed kanji, zen garden stones, soft fog, pale jade vapor, micro-engraved surface relief, handcrafted edge bevels, layered translucent depth, subtle bioluminescent glow, kintsugi-like vein logic, floating accent fragments, cinematic rim lighting, museum-grade overhead fill</li><li><strong>Use Cases:</strong> Meditation room decor, mindfulness gift, study desk accent, spiritual art collectible, Japanese-inspired interior, yoga studio ornament, musician’s keepsake</li></ul><p><strong>Image Note:</strong> The main image shows the actual product customers receive. Additional images are bonus concept/detail reference images and do not represent extra products or selectable variations.</p><p><em>Image Note:</em>",$89.99,Collector Acrylic Relic Bamboo Flute Whispering Shakuhachi Meditation 5x7 Decor,"<h2>Collector Acrylic Relic Bamboo Flute Whispering Shakuhachi Meditation 5x7 Decor</h2><p>A Quiet Jade collection piece built for desks, bookshelves, altar corners, office focus spaces, and collector displays. The visual direction leans into smoky jade tones, quiet luxury decor language, kintsugi detail, and deep-work atmosphere instead of generic mass-market wall art.</p><ul><li><strong>Includes:</strong> One 5x7 vertical acrylic photo block.</li><li><strong>Material:</strong> Acrylic block display with depth, gloss, and light-reflective finish.</li><li><strong>Style:</strong> Zen collector aesthetic; smoky jade, wabi-sabi, scholar-room mood.</li><li><strong>Best For:</strong> apartment decor, reading nook styling, focused workspaces, collectors, and giftable room accents.</li></ul><p><strong>Image Note:</strong> The main image shows the physical product customers receive. Additional gallery images are concept, detail, or collection-reference views and are not extra products or selectable variations.</p><p><strong>Search Themes:</strong> Bamboo Flute Whispering Shakuhachi Medit, Smoky Jade, Quiet Luxury Decor, Deep Work Visuals, Reading Nook Decor, Wabi Sabi Decor, Scholar Room, Apartment Decor, Jade Art, Kintsugi Aesthetic, Collector Gift, Meditation Decor, Calm Desk Art</p><p><small>Reference SKU: Acrylic-Zen-0009; Subject: Bamboo Flute Whispering Shakuhachi Meditation</small></p>",$89.99
2026-05-07 00:46:18 -0400,Acrylic-Zen-0010,69f810485da263f75f049bf8,406903213858,Zen Lotus Seed Pod Vessel 5x7 Acrylic Block for Mindful Desk Decor Shelf Study,"<p>Embrace serene balance with this mentor-grade acrylic block featuring a floating dried lotus seed pod vessel in weathered terracotta and dusty sage tones. The intricate honeycomb seed chambers, golden pollen particles, and warm amber reflection evoke a botanical meditation object, perfect for cultivating calm in any space.</p><p>This 5x7 premium acrylic block transforms your desk, shelf, or altar into a minimalist sanctuary. The hyper-detailed 3D relief and subtle internal glow create a museum-quality collectible that pairs beautifully with journals, water bottles, or laptop setups for daily mindfulness practice.</p><ul><li><strong>Includes:</strong> One 5x7 acrylic block with Zen Lotus Seed Pod Vessel artwork</li><li><strong>Material:</strong> High-clarity acrylic with UV-resistant print, 3D depth effect</li><li><strong>Size:</strong> 5x7 inches (12.7 x 17.8 cm)</li><li><strong>Style:</strong> Zen Mentor-Grade – calm, minimalist, nature-inspired</li><li><strong>DNA Profile:</strong> Dried Lotus Pod, Terracotta Patina, Golden Pollen, Amber Reflection, honeycomb texture, burnt umber accents, kintsugi vein logic, bioluminescent glow</li><li><strong>Use Cases:</strong> Meditation desk decor, yoga studio accent, mindful gift for journaling, water bottle companion, laptop workspace zen</li></ul><p><strong>Image Note:</strong> The main image shows the actual product customers receive. Additional images are bonus concept/detail reference images and do not represent extra products or selectable variations.</p><p><em>Image Note:</em>",$89.99,Smoky Jade Desk Object Lotus Seed Pod Vessel for 5x7 Acrylic Photo Block Decor,"<h2>Smoky Jade Desk Object Lotus Seed Pod Vessel for 5x7 Acrylic Photo Block Decor</h2><p>A Quiet Jade collection piece built for desks, bookshelves, altar corners, office focus spaces, and collector displays. The visual direction leans into smoky jade tones, quiet luxury decor language, kintsugi detail, and deep-work atmosphere instead of generic mass-market wall art.</p><ul><li><strong>Includes:</strong> One 5x7 vertical acrylic photo block.</li><li><strong>Material:</strong> Acrylic block display with depth, gloss, and light-reflective finish.</li><li><strong>Style:</strong> Zen collector aesthetic; smoky jade, wabi-sabi, scholar-room mood.</li><li><strong>Best For:</strong> apartment decor, reading nook styling, focused workspaces, collectors, and giftable room accents.</li></ul><p><strong>Image Note:</strong> The main image shows the physical product customers receive. Additional gallery images are concept, detail, or collection-reference views and are not extra products or selectable variations.</p><p><strong>Search Themes:</strong> Lotus Seed Pod Vessel for, Smoky Jade, Quiet Luxury Decor, Deep Work Visuals, Reading Nook Decor, Wabi Sabi Decor, Scholar Room, Apartment Decor, Jade Art, Kintsugi Aesthetic, Collector Gift, Meditation Decor, Calm Desk Art</p><p><small>Reference SKU: Acrylic-Zen-0010; Subject: Lotus Seed Pod Vessel for</small></p>",$89.99
2026-05-07 00:46:18 -0400,Sticker-Academia-0004,69f192aa5ea38382140f1d7b,406892408950,4pc Kiss-Cut Sticker Set Mechanical Raven Familiar Laptop Journal Bottle Dark,"4pc Kiss-Cut Sticker Set Mechanical Raven Familiar Laptop Journal Bottle Dark A 4-piece 6x6 kiss-cut vinyl sticker set made for laptops, journals, planners, water bottles, scrapbooks, study corners, and small gift bundles. Design style: Dark Academia relic art with a premium illustrated look, made for buyers who want a more atmospheric sticker set than generic decals. What you receive: one physical 4-piece sticker set. The main product image shows the actual set layout customers receive. Additional gallery images are close-up/detail previews of the artwork and are not extra products or separate variations. Production note: this item is produced on demand by a professional print partner and ships as a finished physical sticker product. Original listing note: <h2>Mechanical Raven Familiar - Kiss-Cut Sticker</h2><p>A polished Academia aesthetic piece for writers, learners, library lovers, and collectors of moody scholarly decor. Built for readers and collectors, this Mechanical Raven Familiar kiss-cut sticker blends literary atmosphere with vintage study-room style.</p><p>The design works well across journal spreads, library shelves, dorm rooms, studio desks, and cozy personal collections, while the title, material notes, and DNA profile stay specific<p><strong>Image Note:</strong> The main image shows the actual product customers receive. Additional images are bonus concept/detail reference images and do not represent extra products or selectable variations.</p>",$11.99,Smoky Jade Sticker Set Mechanical Raven Familiar Bottle 4pc 6x6 Kiss-Cut Vinyl,"<h2>Smoky Jade Sticker Set Mechanical Raven Familiar Bottle 4pc 6x6 Kiss-Cut Vinyl</h2><p>A Quiet Jade collection piece built for laptops, journals, planners, bottles, reading notebooks, and study desk gifts. The visual direction leans into smoky jade tones, quiet luxury decor language, kintsugi detail, and deep-work atmosphere instead of generic mass-market wall art.</p><ul><li><strong>Includes:</strong> One 6x6 kiss-cut vinyl sticker sheet with four coordinated designs.</li><li><strong>Material:</strong> Durable kiss-cut vinyl sticker sheet produced on demand through Printify.</li><li><strong>Style:</strong> Academia collector aesthetic; smoky jade, wabi-sabi, scholar-room mood.</li><li><strong>Best For:</strong> apartment decor, reading nook styling, focused workspaces, collectors, and giftable room accents.</li></ul><p><strong>Image Note:</strong> The main image shows the physical product customers receive. Additional gallery images are concept, detail, or collection-reference views and are not extra products or selectable variations.</p><p><strong>Search Themes:</strong> Mechanical Raven Familiar Bottle, Smoky Jade, Quiet Luxury Decor, Deep Work Visuals, Reading Nook Decor, Wabi Sabi Decor, Scholar Room, Apartment Decor, Jade Art, Kintsugi Aesthetic, Collector Gift, Dark Study Decor, Library Wall Art</p><p><small>Reference SKU: Sticker-Academia-0004; Subject: Mechanical Raven Familiar Bottle</small></p>",$11.99
2026-05-07 00:46:18 -0400,Sticker-Zen-0010,69f1b00840c796ee97058144,406892414116,Floating Island Sanctuary 4pc 6x6 Kiss-Cut Sticker Zen Aesthetic Laptop Journal,"<h2>Floating Island Sanctuary Sticker Kiss-Cut Sticker</h2><p>Bring calm and balance into your daily routine with this Floating Island Sanctuary Sticker zen aesthetic kiss-cut sticker.</p><p>Designed for study rooms, creative workspaces, shelves, gallery walls, and collectible aesthetic decor, this sticker blends niche aesthetic appeal with collectible mentor-grade artwork.</p><ul><li><strong>Includes:</strong> One 6x6 kiss-cut sheet with 4 individual sticker designs.</li><li><strong>Material:</strong> Durable kiss-cut vinyl sticker sheet with waterproof finish.</li><li><strong>Size:</strong> 6x6 kiss-cut sheet with four coordinated designs.</li><li><strong>Style:</strong> Zen Mentor-Grade; Zen aesthetic.</li><li><strong>DNA Profile:</strong> A tiny, floating island with a single pine tree, the island is a chunk of Mossy Granite, the tree is Ancient Bristlecone Pine with bark like Petrified Wood, a small glowing lantern hangs from a branch, dreamlike, , , , , 3D relief effect, sharp focus,</li><li><strong>Best For:</strong> mindfulness lovers, minimalists, journal keepers, yoga enthusiasts, and peaceful room setups.</li></ul><p><strong>SEO Keywords:</strong> floating island sticker, mossy granite, ancient tree, miniature world, fantasy landscape, dream core, serene escape, glowing lantern, imaginative art, detailed diorama</p><p><strong>Image Note:</strong> The main image shows the actual product customers receive. Additional images are bonus concept/detail reference images and do not represent extra products or selectable variations.</p><p>Complete the collection with matching Alchemy pieces.</p><p><small>Reference SKU: Sticker-Zen-0010</small></p>",$11.99,Reading Nook Vinyl Set Floating Island Sanctuary 4pc 6x6 Kiss-Cut Vinyl Quiet,"<h2>Reading Nook Vinyl Set Floating Island Sanctuary 4pc 6x6 Kiss-Cut Vinyl Quiet</h2><p>A Quiet Jade collection piece built for laptops, journals, planners, bottles, reading notebooks, and study desk gifts. The visual direction leans into smoky jade tones, quiet luxury decor language, kintsugi detail, and deep-work atmosphere instead of generic mass-market wall art.</p><ul><li><strong>Includes:</strong> One 6x6 kiss-cut vinyl sticker sheet with four coordinated designs.</li><li><strong>Material:</strong> Durable kiss-cut vinyl sticker sheet produced on demand through Printify.</li><li><strong>Style:</strong> Zen collector aesthetic; smoky jade, wabi-sabi, scholar-room mood.</li><li><strong>Best For:</strong> apartment decor, reading nook styling, focused workspaces, collectors, and giftable room accents.</li></ul><p><strong>Image Note:</strong> The main image shows the physical product customers receive. Additional gallery images are concept, detail, or collection-reference views and are not extra products or selectable variations.</p><p><strong>Search Themes:</strong> Floating Island Sanctuary, Smoky Jade, Quiet Luxury Decor, Deep Work Visuals, Reading Nook Decor, Wabi Sabi Decor, Scholar Room, Apartment Decor, Jade Art, Kintsugi Aesthetic, Collector Gift, Meditation Decor, Calm Desk Art</p><p><small>Reference SKU: Sticker-Zen-0010; Subject: Floating Island Sanctuary</small></p>",$11.99
